{
    "indices" : {
        "buffer" : "indices.bin",
        "byteOffset" : 0,
        "count" : 1024,
        "type" : "UNSIGNED_SHORT",
	    "extra" : {
	       "Application specific" : "The extra object can contain any properties."
	    }
    },
    "material" : "exampleMaterial",
    "primitive" : "TRIANGLES",
    "vertexAttributes" : [{    
            "accessor" : "accessorPosition",
            "semantic" : "POSITION"
        }, { 
            "accessor" : "accessorNormal",
            "semantic" : "NORMAL"
        }
    ],
    "extra" : {
       "Application specific" : "The extra object can contain any properties."
    }     
}
